TOPIC,TOPIC PROPORTION,TOP WORDS,al,biomed,et,exampl,f,inform,journal,semant
1,0.082095183,"et, al, f, biomed, provid ",0.148060197,8.52E-31,0.780678349,6.17E-84,0.071261455,8.30E-93,0,1.44E-56
2,0.041731314,"semant, journal, biomed, inform, f ",0,0.210872491,1.27E-124,0.048067586,0.08311467,0.102555326,0.261737705,0.293640638
3,0.046738775,"ontolog, biomed, scienc, open, exampl ",0,0.108540986,7.54E-95,0.059213718,0.017805218,6.08E-104,0,1.42E-22
4,0.021720378,"map, data, f, semant, biomed ",0,8.09E-39,5.97E-84,3.37E-142,0.142378175,1.53E-45,0,2.47E-38
5,0.024388644,"annot, term, f, ontolog, semant ",0,3.46E-46,1.21E-44,1.26E-126,1.16E-15,9.72E-105,0,1.89E-25
6,0.020115495,"class, al.th, f, et, entiti ",0,1.72E-32,2.91E-11,3.36E-95,0.077293298,4.00E-97,0,8.92E-66
7,0.033554663,"ontolog, develop, term, f, biomed ",0,5.85E-13,3.67E-88,5.12E-51,0.004023194,6.33E-74,0,9.37E-53
8,0.013980877,"end, inform, exampl, author, et ",0,2.01E-71,1.28E-05,0.269519781,7.95E-21,0.309102035,0,8.19E-78
9,0.015493315,"function, provid, ontolog, inform, f ",0,3.17E-43,1.73E-137,1.67E-79,0.078858493,0.091798414,0,1.62E-48
10,0.007882722,"number, f, term, et, provid ",0,6.28E-93,1.22E-22,2.05E-119,0.184782482,1.58E-93,0,8.59E-89
11,0.007907238,"knowledg, f, et, biomed, exampl ",0,1.44E-20,3.73E-20,3.20E-23,9.32E-16,1.89E-106,0,1.56E-34
12,0.027642137,"term, author, defin, f, semant ",0,8.25E-31,1.40E-39,5.18E-52,0.003205077,3.88E-25,0,2.30E-17
13,0.053483331,"files_keyword, f, biomed, term, semant ",0,5.92E-21,4.30E-40,1.02E-62,1.21E-07,3.18E-51,0,2.93E-29
14,0.053488974,"run, f, biomed, term, semant ",0,5.96E-21,4.29E-40,1.02E-62,1.21E-07,3.20E-51,0,2.93E-29
15,0.013337179,"queri, term, f, semant, ontolog ",0,3.33E-44,3.26E-77,5.00E-197,2.51E-19,6.85E-129,0,2.38E-28
16,0.053485731,"bigdata, f, biomed, term, semant ",0,5.95E-21,4.27E-40,1.02E-62,1.20E-07,3.17E-51,0,2.94E-29
17,0.053488982,"textfil, f, biomed, term, semant ",0,5.90E-21,4.33E-40,1.01E-62,1.21E-07,3.16E-51,0,2.91E-29
18,0.053490465,"txt, f, biomed, term, semant ",0,6.01E-21,4.36E-40,1.02E-62,1.21E-07,3.22E-51,0,2.96E-29
19,0.013814584,"entiti, name, f, biomed, et ",0,1.62E-07,1.82E-23,3.15E-102,0.001864675,6.33E-34,0,2.30E-37
20,0.011184025,"avail, data, inform, f, exampl ",0,8.73E-35,8.70E-49,6.29E-29,1.64E-24,8.99E-06,0,5.84E-30
21,0.025368463,"data, access, open, f, semant ",0,4.35E-46,5.76E-127,7.18E-73,0.066064428,2.91E-86,0,1.84E-08
22,0.007718286,"dataset, f, provid, data, biomed ",0,8.66E-36,5.20E-46,3.19E-104,5.43E-06,3.01E-125,0,8.72E-39
23,0.012263856,"facilit, biomed, provid, semant, data ",0,0.153136523,2.18E-112,5.95E-80,0.000299746,1.14E-111,0,0.117978252
24,0.006884418,"relev, f, provid, biomed, semant ",0,1.91E-21,1.78E-45,2.55E-56,4.14E-06,1.81E-111,0,1.45E-28
25,0.060901721,"project, f, biomed, semant, term ",0,1.10E-20,8.24E-45,2.78E-54,0.00643847,1.28E-48,0,1.42E-28
26,0.014763823,"integr, data, inform, open, f ",0,3.67E-14,2.06E-115,3.27E-71,0.035748734,0.091102038,0,3.66E-08
27,0.018037199,"provid, applic, f, biomed, semant ",0,2.14E-15,4.29E-63,7.70E-32,1.27E-05,9.41E-110,0,2.27E-22
28,0.007827233,"s, f, ontolog, term, inform ",0,1.44E-61,1.50E-118,2.90E-62,0.002683954,5.19E-45,0,2.46E-76
29,0.006385973,"text, f, biomed, semant, et ",0,2.26E-15,1.71E-24,6.27E-60,6.29E-10,1.16E-40,0,1.04E-18
30,0.036248013,"f, phenotyp, semant, et, term ",0,1.26E-35,4.31E-28,6.89E-87,0.81213247,8.77E-44,0,4.01E-19
31,0.007031894,"improv, f, provid, et, data ",0,2.18E-57,2.26E-34,8.41E-76,0.002386631,1.98E-76,0,5.40E-59
32,0.010931231,"list, inform, f, term, ontolog ",0,5.08E-21,1.38E-71,7.93E-24,0.074150637,0.170839767,0,8.08E-69
33,0.014249971,"represent, f, ontolog, term, biomed ",0,2.43E-26,2.25E-64,1.59E-71,0.333342321,2.11E-48,0,1.96E-54
34,0.008062473,"structur, f, ontolog, term, inform ",0,4.48E-28,9.90E-102,8.74E-76,0.061901707,4.75E-28,0,1.78E-50
35,0.007655647,"exist, f, ontolog, biomed, provid ",0,1.46E-16,1.94E-98,4.43E-38,0.026392482,1.20E-68,0,2.29E-37
36,0.01036191,"set, f, data, semant, provid ",0,6.92E-55,9.93E-73,6.17E-130,2.08E-18,2.78E-63,0,1.75E-28
37,0.008174069,"domain, f, biomed, exampl, open ",0,9.58E-05,3.78E-78,7.51E-17,0.001949575,3.37E-60,0,8.01E-24
38,0.069291493,"biomed, page, semant, f, inform ",0,0.385211369,2.69E-57,3.28E-45,0.005957685,1.67E-07,0,0.285498192
39,0.011395413,"process, semant, f, biomed, term ",0,8.35E-11,1.03E-38,1.66E-136,4.03E-07,4.43E-74,0,0.274518599
40,0.007422902,"addit, f, semant, data, biomed",0,2.35E-09,2.00E-51,2.42E-44,0.119329346,1.54E-51,0,6.79E-07
